title,sinopsis,isbn
Message in a Bottle,"Divorced and disillusioned about relationships, Theresa Osborne is jogging when she finds a bottle on the beach. Inside is a letter of love and longing to ""Catherine,"" signed simply ""Garrett."" Challenged by the mystery and pulled by emotions she doesn't fully understand, Theresa begins a search for this man that will change her life. What happens to her is unexpected, perhaps miraculous-an encounter that embraces all our hopes for finding someone special, for having a love that is timeless and everlasting.... Nicholas Sparks exquisitely chronicles the human heart. In his first bestselling novel, The Notebook, he created a testament to romantic love that touched readers around the world. Now in this New York Times bestseller, he renews our faith in destiny, in the ability of lovers to find each other no matter where, no matter when...",0446676071
Nickel and Dimed: On (Not) Getting By in America,,0805063897
Fantastic Beasts and Where to Find Them,,0439321603
Around the World in Eighty Days,,014044906X
"Dark Lover (Black Dagger Brotherhood, #1)",,0451216954
Kitchen Confidential: Adventures in the Culinary Underbelly,,0060899220
"Killing Floor (Jack Reacher, #1)",,0515141429
"Assassin''s Apprentice (Farseer Trilogy, #1)",,0006480098
The Jungle,,1884365302
The Blind Assassin,"More than fifty years on, Iris Chase is remembering Laura's mysterious death. And so begins an extraordinary and compelling story of two sisters and their secrets. Set against a panoramic backdrop of twentieth-century history, The Blind Assassin is an epic tale of memory, intrigue and betrayal...",1860498809
House of Sand and Fog,"A former colonel in the Iranian Air Force yearns to restore his family's dignity. A recovering alcoholic and addict down on her luck struggles to hold on to the one thing she has left. And her lover, a married cop, is driven to extremes to win her love. In this masterpiece of American realism and Shakespearean consequence, Andre Dubus III's unforgettable characters—people with ordinary flaws, looking for a small piece of ground to stand on—careen toward inevitable conflict, their tragedy painting a shockingly true picture of the country we live in today. (From W. W. Norton)",0375727345
Dolores Claiborne,,2266047426
"Xenocide (Ender''s Saga, #3)",,0312861877
Insomnia,,8497597729
"The Queen of the Damned (The Vampire Chronicles, #3)",,0345419626
Safe Haven,Large-Type,044654759X
"Daughter of Smoke & Bone (Daughter of Smoke & Bone, #1)",,0316134023
"Drums of Autumn (Outlander, #4)",,0385335989
"The Angel Experiment (Maximum Ride, #1)",,0446617792
Steve Jobs,"Based on more than forty interviews with Jobs conducted over two years -- as well as interviews with more than a hundred family members, friends, adversaries, competitors, and colleagues -- Walter Isaacson has written a riveting story of the roller-coaster life and searingly intense personality of a creative entrepreneur whose passion for perfection and ferocious drive revolutionized six industries: personal computers, animated movies, music, phones, tablet computing, and digital publishing. At a time when America is seeking ways to sustain its innovative edge, and when societies around the world are trying to build digital-age economies, Jobs stands as the ultimate icon of inventiveness and applied imagination. He knew that the best way to create value in the twenty-first century was to connect creativity with technology. He built a company where leaps of the imagination were combined with remarkable feats of engineering. Although Jobs cooperated with this book, he asked for no control over what was written nor even the right to read it before it was published. He put nothing off-limits. He encouraged the people he knew to speak honestly. And Jobs speaks candidly, sometimes brutally so, about the people he worked with and competed against. His friends, foes, and colleagues provide an unvarnished view of the passions, perfectionism, obsessions, artistry, devilry, and compulsion for control that shaped his approach to business and the innovative products that resulted. Driven by demons, Jobs could drive those around him to fury and despair. But his personality and products were interrelated, just as Apple's hardware and software tended to be, as if part of an integrated system. His tale is instructive and cautionary, filled with lessons about innovation, character, leadership, and values. - Publisher.",1451648537
The Phantom of the Opera,,0060809248
"The Bean Trees (Greer Family, #1)",,0812474945
Empire Falls,"""Dexter County, Maine, and specifically the town of Empire Falls, has seen better days, and for decades, in fact, only a succession from bad to worse. One by one, its logging and textile enterprises have gone belly-up, and the once vast holdings of the Whiting clan (presided over by the last scion's widow) now mostly amount to decrepit real estate. The working classes, meanwhile, continue to eke out whatever meager promise isn't already boarded up."". ""Miles Roby gazes over this ruined kingdom from the Empire Grill, an opportunity of his youth that has become the albatross of his daily and future life. Called back from college and set to work by family obligation - his mother ailing, his father a loose cannon - Miles never left home again. Even so, his own obligations are manifold: a pending divorce; a troubled younger brother; and, not least, a peculiar partnership in the failing grill with none other than Mrs. Whiting. All of these, though, are offset by his daughter, Tick, whom he guides gently and proudly through the tribulations of adolescence."" ""A decent man encircled by history and dreams, by echoing churches and abandoned mills, by the comforts and feuds provided by lifelong friends and neighbors, Miles is also a patient, knowing guide to the rich, hardscrabble nature of Empire Falls: fathers and sons and daughters, living and dead, rich and poor alike.""--BOOK JACKET.",0375726403
"Inheritance (The Inheritance Cycle, #4)",,0375856110
"Specials (Uglies, #3)",,0689865406
Gerald's Game,"Gerald and Jessie Burlingame have gone to their summer home on a warm weekday in October for a romantic interlude. After being handcuffed to her bedposts, Jessie tires of her husband's games, but when Gerald refuses to stop she lashes out at him with deadly consequences. Still handcuffed, she is trapped and alone. Painful memories from her childhood bedevil her. Her only company is a hungry stray dog and the sundry voices that populate her mind. As night comes, she is unsure whether it is her imagination or if she has another companion: someone watching her from the corner of her dark bedroom. ([source][1]) [1]: https://www.stephenking.com/library/novel/gerald_s_game.html",0831727527
The Hiding Place: The Triumphant True Story of Corrie Ten Boom,,0553256696
The Hunchback of Notre-Dame,,0451527887
"Oedipus Rex  (The Theban Plays, #1)",,1580495931
Pippi Longstocking,,0142402494
The Absolutely True Diary of a Part-Time Indian,,0316013684
The Boys in the Boat: Nine Americans and Their Epic Quest for Gold at the 1936 Berlin Olympics,,067002581X
The Bonesetter's Daughter,"LuLing Young is in her eighties, and finally beginning to feel the effects of old age. Trying to hold on to the evaporating past, she begins to write down all that she can remember of her life as a girl in China. Meanwhile, her daughter Ruth, a ghostwriter for authors of self-help books, is losing the ability to speak up for herself in front of the man she lives with. LuLing can only look on, helpless: her prickly relationship with her daughter does not make it easy to discuss such matters. In turn, Ruth has begun to suspect that something is wrong with her mother: she says so many confusing and contradictory things. Ruth decides to move in with her ailing mother, and while tending to her discovers the story LuLing wrote in Chinese, of her tumultuous life growing up in a remote mountain village known as Immortal Heart. LuLing tells of the secrets passed along by her mute nursemaid, Precious Auntie; of a cave where dragon bones are mined and where Peking Man was discovered; of the crumbling ravine known as the End of the World, where Precious Auntie's bones lie, and of the curse that LuLing believes she released through betrayal. Like layers of sediment being removed, each page unfolds into an even greater mystery: Who was Precious Auntie, whose suicide changed the path of LuLing's life? Set in contemporary San Francisco and pre-war China, ‘The Bonesetter’s Daughter’ is an excavation of the human spirit. With great warmth and humour, Amy Tan gives us a mesmerising story of a mother and daughter discovering together that what they share in their bones through history and heredity is priceless beyond measure.",0345457374
A Portrait of the Artist as a Young Man,,0142437344
"Postmortem (Kay Scarpetta, #1)",,0743477154
A Room with a View,"Lucy has her rigid, middle-class life mapped out for her, until she visits Florence with her uptight cousin Charlotte, and finds her neatly ordered existence thrown off balance. Her eyes are opened by the unconventional characters she meets at the Pension Bertolini: flamboyant romantic novelist Eleanor Lavish, the Cockney Signora, curious Mr Emerson and, most of all, his passionate son George. Lucy finds herself torn between the intensity of life in Italy and the repressed morals of Edwardian England, personified in her terminally dull fiancé Cecil Vyse. Will she ever learn to follow her own heart?",1420925431
"Flowers in the Attic (Dollanganger, #1)",,0743496310
The Bluest Eye,"Each night Pecola prayed for blue eyes. In her eleven years, no one had ever noticed Pecola. But with blue eyes, she thought, everything would be different. She would be so pretty that her parents would stop fighting. Her father would stop drinking. Her brother would stop running away. If only she could be beautiful. If only people would look at her. When someone finally did, it was her father, drunk. He raped her. Soon she would bear his child...",0452287065
"Hopeless (Hopeless, #1)",,1301949825
"Mr. Mercedes (Bill Hodges Trilogy, #1)",,1476754454
The English Patient,"With ravishing beauty and unsettling intelligence, Michael Ondaatje's Booker Prize-winning novel traces the intersection of four damaged lives in an Italian villa at the end of World War II. Hana, the exhausted nurse; the maimed thief, Caravaggio; the wary sapper, Kip: each is haunted by the riddle of the English patient, the nameless, burned man who lies in an upstairs room and whose memories of passion, betrayal, and rescue illuminate this book like flashes of heat lightning",0771068719
Plain Truth,"From the bestselling author of My Sister's Keeper comes the riveting story of a murder that shatters the picturesque calm of Amish country -- and tests the heart and soul of the lawyer defending the woman at the center of the storm. The discovery of a dead infant in an Amish barn shakes Lancaster County to its core. But the police investigation leads to a more shocking disclosure: circumstantial evidence suggests that eighteen-year-old Katie Fisher, an unmarried Amish woman believed to be the newborn's mother, took the child's life. When Ellie Hathaway, a disillusioned big-city attorney, comes to Paradise, Pennsylvania, to defend Katie, two cultures collide -- and for the first time in her high-profile career, Ellie faces a system of justice very different from her own. Delving deep inside the world of those who live ""plain,"" Ellie must find a way to reach Katie on her terms. And as she unravels a tangled murder case, Ellie also looks deep within -- to confront her own fears and desires when a man from her past reenters her life.",0743275012
Reading Lolita in Tehran,"Every Thursday morning for two years in the Islamic Republic of Iran, Azar Nafisi, a bold and inspired teacher, secretly gathered seven of her most committed female students to read forbidden Western classics. Some came from conservative and religious families, others were progressive and secular; some had spent time in jail. They were shy and uncomfortable at first, unaccustomed to being asked to speak their minds, but soon they removed their veils and began to speak more freely–their stories intertwining with the novels they were reading by Jane Austen, F. Scott Fitzgerald, Henry James, and Vladimir Nabokov. As Islamic morality squads staged arbitrary raids in Tehran, as fundamentalists seized hold of the universities and a blind censor stifled artistic expression, the women in Nafisi's living room spoke not only of the books they were reading but also about themselves, their dreams and disappointments. Azar Nafisi's luminous masterwork gives us a rare glimpse, from the inside, of women's lives in revolutionary Iran. Reading Lolita in Tehran is a work of great passion and poetic beauty, a remarkable exploration of resilience in the face of tyranny, and a celebration of the liberating power of literature. - Publisher.",0812971060
The Undomestic Goddess,"Workaholic attorney Samantha Sweeting has just done the unthinkable. She's made a mistake so huge, it'll wreck any chance of a partnership. Going into utter meltdown, she walks out of her London office, gets on a train, and ends up in the middle of nowhere. Asking for directions at a big, beautiful house, she's mistaken for an interviewee and finds herself being offered a job as housekeeper. Her employers have no idea they've hired a lawyer--and Samantha has no idea how to work the oven. She can't sew on a button, bake a potato, or get the #@%# ironing board to open. How she takes a deep breath and begins to cope--and finds love--is a story as delicious as the bread she learns to bake. But will her old life ever catch up with her? And if it does...will she want it back?From the Hardcover edition.",0385338694
The Dark Half,"The Dark Half is a horror novel by American writer Stephen King, published in 1989. Publishers Weekly listed The Dark Half as the second best-selling book of 1989 behind Tom Clancy's Clear and Present Danger. The novel was adapted into a feature film of the same name in 1993.",045052468X
"In the Garden of Beasts: Love, Terror, and an American Family in Hitler''s Berlin",,0307408841
About a Boy,"Nick Hornby's second bestselling novel is about sex, manliness and fatherhood. Will is thirty-six, comfortable and child-free. And he's discovered a brilliant new way of meeting women - through single-parent groups. Marcus is twelve and a little bitnerdish: he's got the kind of mother who made him listen to Joni Mitchell rather than Nirvana. Perhaps they can help each other out a little bit, and both can start to act their age.",0140285679
Olive Kitteridge,"Olive Kitteridge: indomitable, compassionate and often unpredictable. A retired schoolteacher in a small coastal town in Maine, as she grows older she struggles to make sense of the changes in her life. She is a woman who sees into the hearts of those around her, their triumphs and tragedies. We meet her stoic husband, bound to her in a marriage both broken and strong, and a young man who aches for the mother he lost - and whom Olive comforts by her mere presence, while her own son feels overwhelmed by her complex sensitivities. A penetrating, vibrant exploration of the human soul, the story of Olive Kitteridge will make you laugh, nod in recognition, wince in pain, and shed a tear or two.",140006208X
"Evermore (The Immortals, #1)","Since a horrible accident claimed the lives of her family, Ever can see auras, hear people's thoughts, and know a person's entire life story by touch. Going out of her way to avoid human contact and suppress her abilities has branded her as a freak at her new high school—but everything changes when she meets Damen. Damen Auguste is gorgeous, exotic and wealthy. He's the only one who can silence the noise and random energy in her head—wielding a magic so intense, it's as though he can see straight into her soul. As Ever is drawn deeper into his enticing world of secrets and mystery, she's left with more questions than answers. She has no idea just who he really is—or what he is. The only thing she knows to be true is she's falling deeply and helplessly in love with him.",031253275X
The Trial,,0099428644
Half Broke Horses,"It is 1970 in a small town in California. ""Bean"" Holladay is twelve and her sister, Liz, is fifteen when their artistic mother, Charlotte, takes off to find herself, leaving her girls enough money to last a month or two. When Bean returns from school one day and sees a police car outside the house, she and Liz decide to take the bus to Virginia, where their widowed Uncle Tinsley lives in the decaying mansion that's been in Charlotte's family for generations ... An impetuous optimist, Bean soon discovers who her father was, and hears stories about why their mother left Virginia in the first place. Money is tight, and the sisters start babysitting and doing office work for Jerry Maddox, foreman of the mill in town, who bullies his workers, his tenants, his children, and his wife. Liz is whip-smart--an inventor of word games, reader of Edgar Allan Poe, nonconformist. But when school starts in the fall, it's Bean who easily adjusts, and Liz who becomes increasingly withdrawn. And then something happens to Liz in the car with Maddox.",1416586288
"The Secret (The Secret, #1)",,1582701709
"The Alienist (Dr. Laszlo Kreizler, #1)",,0812976142
"Lamb: The Gospel According to Biff, Christ''s Childhood Pal",,0380813815
The Age of Innocence,,159308143X
Man's Search for Meaning,,080701429X
"The Dark Tower (The Dark Tower, #7)",,1416524525
The Witch of Blackbird Pond,"Orphaned Kit Tyler knows, as she gazes for the first time at the cold, bleak shores of Connecticut Colony, that her new home will never be like the shimmering Caribbean island she left behind. In her relatives' stern Puritan community, she feels like a tropical bird that has flown to the wrong part of the world, a bird that is now caged and lonely. The only place where Kit feels completely free is in the meadows, where she enjoys the company of the old Quaker woman known as the Witch of Blackbird Pond, and on occasion, her young sailor friend Nat. But when Kit's friendship with the ""witch"" is discovered, Kit is faced with suspicion, fear, and anger. She herself is accused of witchcraft!",0440995779
"The Princess Diaries (The Princess Diaries, #1)",,0613371658
The Hours,"A daring, deeply affecting third novel by the author of A Home at the End of the World and Flesh and Blood. In The Hours, Michael Cunningham, widely praised as one of the most gifted writers of his generation, draws inventively on the life and work of Virginia Woolf to tell the story of a group of contemporary characters struggling with the conflicting claims of love and inheritance, hope and despair. The narrative of Woolf's last days before her suicide early in World War II counterpoints the fictional stories of Richard, a famous poet whose life has been shadowed by his talented and troubled mother, and his lifelong friend Clarissa, who strives to forge a balanced and rewarding life in spite of the demands of friends, lovers, and family. Passionate, profound, and deeply moving, this is Cunningham's most remarkable achievement to date.",0312305060
"Girl, Interrupted","In 1967, after a session with a psychiatrist she'd never seen before, eighteen-year-old Susanna Kaysen was put in a taxi and sent to McLean Hospital. She spent most of the next two years on the ward for teenage girls in a psychiatric hospital as renowned for its famous clientele--Sylvia Plath, Robert Lowell, James Taylor, and Ray Charles--as for its progressive methods of treating those who could afford its sanctuary. Kaysen's memoir encompasses horror and razor-edged perception while providing vivid portraits of her fellow patients and their keepers. It is a brilliant evocation of a ""parallel universe"" set within the kaleidoscopically shifting landscape of the late sixties. Girl, Interrupted is a clear-sighted, unflinching document that gives lasting and specific dimension to our definitions of sane and insane, mental illness and recovery.",0679746048
Heaven is for Real: A Little Boy's Astounding Story of His Trip to Heaven and Back,,0849946158
My Ántonia,"My Antonia, first published 1918, is one of Willa Cather's greatest works. It is the last novel in the Prairie trilogy, preceded by O Pioneers! and The Song of the Lark.My Antonia tells the stories of several immigrant families who move out to rural Nebraska to start new lives in America, with a particular focus on a Bohemian family, the Shimerdas, whose eldest daughter is named Antonia. The book's narrator, Jim Burden, arrives in the fictional town of Black Hawk, Nebraska, on the same train as the Shimerdas, as he goes to live with his grandparents after his parents have died. Jim develops strong feelings for Antonia, something between a crush and a filial bond, and the reader views Antonia's life, including its attendant struggles and triumphs, through that lens.",1583485090
Orange Is the New Black,"This is a compelling, often hilarious, and unfailingly compassionate portrait of life inside a women's prison. With a career, a boyfriend, and a loving family, the author barely resembles the reckless young woman who delivered a suitcase of drug money ten years before. But that past has caught up with her. Convicted and sentenced to fifteen months at the infamous federal correctional facility in Danbury, Connecticut, the well-heeled Smith College alumna is now inmate #11187-424, one of the millions of people who disappear ""down the rabbit hole"" of the American penal system. From her first strip search to her final release, she learns to navigate this strange world with its strictly enforced codes of behavior and arbitrary rules. She meets women from all walks of life, who surprise her with small tokens of generosity, hard words of wisdom, and simple acts of acceptance.",0385523386
"Mort (Death, #1; Discworld, #4)",,0061020680
"Wolves of the Calla (The Dark Tower, #5)",,141651693X
Paradise Lost,,0140424393
"One Fish, Two Fish, Red Fish, Blue Fish","A story-poem about the activities of such unusual animals as the Nook, Wump, Yink, Yop, Gack, and the Zeds.",0007173687
As I Lay Dying,"Written in stream-of-consciousness style with multiple narrators, the story follows a journey wherein the family of a dead woman try to transport her body to her birthplace in Mississippi in accordance with her wishes. When a ford across a river is flooded they are forced to take a roundabout route and it becomes a desperate race to complete their mission before the body begins to decompose.",067973225X
"Doctor Sleep (The Shining, #2)",,1476727651
"Pandemonium (Delirium, #2)",,006197806X
White Fang,"The story of a wolf/dog cross, who is raised by Indians, and becomes a deadly fighter.",0439236193
"Something Blue (Darcy & Rachel, #2)",,0312323867
"Julie and Julia: 365 Days, 524 Recipes, 1 Tiny Apartment Kitchen: How One Girl Risked Her Marriage, Her Job, and Her Sanity to Master the Art of Living",,031610969X
Because of Winn-Dixie,,0763616052
The Girl Who Loved Tom Gordon,The Girl Who Loved Tom Gordon (1999) is a psychological horror novel by American writer Stephen King.,1416524290
Shanghai Girls (Shanghai Girls #1),,1400067111
Before I Fall,"What if you had only one day to live? What would you do? Who would you kiss? And how far would you go to save your own life?Samantha Kingston has it all: the world's most crush-worthy boyfriend, three amazing best friends, and first pick of everything at Thomas Jefferson High—from the best table in the cafeteria to the choicest parking spot. Friday, February 12, should be just another day in her charmed life.Instead, it turns out to be her last.Then she gets a second chance. Seven chances, in fact. Reliving her last day during one miraculous week, she will untangle the mystery surrounding her death—and discover the true value of everything she is in danger of losing.",0061726818
The Exorcist,"The Exorcist is a 1971 horror novel by American writer William Peter Blatty. The book details the demonic possession of eleven-year-old Regan MacNeil, the daughter of a famous actress, and the two priests who attempt to exorcise the demon. Published by Harper & Row, the novel was the basis of a highly successful film adaptation released two years later, whose screenplay was also written and produced by Blatty, and part of The Exorcist franchise. The novel was inspired by a 1949 case of demonic possession and exorcism that Blatty heard about while he was a student in the class of 1950 at Georgetown University. As a result, the novel takes place in Washington, D.C., near the campus of Georgetown University. In September 2011, the novel was reprinted by Harper Collins to celebrate its fortieth anniversary, with slight revisions made by Blatty as well as interior title artwork by Jeremy Caniglia.",0061007226
"The Lies of Locke Lamora (Gentleman Bastard, #1)",,0553804677
