title,sinopsis,isbn
The Thirteenth Tale,"Sometimes, when you open the door to the past, what you confront is your destiny. Reclusive author Vida Winter, famous for her collection of twelve enchanting stories, has spent the past six decades penning a series of alternate lives for herself. Now old and ailing, she is ready to reveal the truth about her extraordinary existence and the violent and tragic past she has kept secret for so long. Calling on Margaret Lea, a young biographer troubled by her own painful history, Vida disinters the life she meant to bury for good. Margaret is mesmerized by the author's tale of gothic strangeness -- featuring the beautiful and willful Isabelle, the feral twins Adeline and Emmeline, a ghost, a governess,a topiary garden and a devastating fire. Together, Margaret and Vida confront the ghosts that have haunted them while becoming, finally, transformed by the truth themselves.",0743298020
"The Clan of the Cave Bear (Earth''s Children, #1)",,0553381679
The Strange Case of Dr. Jekyll and Mr. Hyde,,0451528956
And the Mountains Echoed,"Presents a story inspired by human love, how people take care of one another, and how choices resonate through subsequent generations. Afghanistan, 1952. Abdullah and his sister Pari live with their father and step-mother in the small village of Shadbagh. Their father, Saboor, is constantly in search of work and they struggle together through poverty and brutal winters. To Adbullah, Pari, as beautiful and sweet-natured as the fairy for which she was named, is everything. What happens to them-and the large and small manners in which it echoes through the lives of so many other people-is proof of the moral complexity of life. This story begins in 1952 Afghanistan with two motherless siblings and moves through complex relationships and generations to the United States, Paris, and Greece, weaving a story of commitment, love, honor, and sacrifice. The plot contains violence.",159463176X
"The Eye of the World (Wheel of Time, #1)",,0812511816
"Inkheart (Inkworld, #1)",,0439709105
The Name of the Rose,,0156001314
"The Selection (The Selection, #1)","For thirty-five girls, the Selection is the chance of a lifetime. The opportunity to escape the life laid out for them since birth. To be swept up in a world of glittering gowns and priceless jewels. To live in a palace and compete for the heart of gorgeous Prince Maxon. But for America Singer, being Selected is a nightmare. It means turning her back on her secret love with Aspen, who is a caste below her. Leaving her home to enter a fierce competition for a crown she doesn't want. Living in a palace that is constantly threatened by violent rebel attacks. Then America meets Prince Maxon. Gradually, she starts to question all the plans she's made for herself—and realizes that the life she's always dreamed of may not compare to a future she never imagined.",0062059939
The Tell-Tale Heart and Other Writings,17 STORIES [Tell-tale Heart](https://openlibrary.org/works/OL41059W) [Black Cat](https://openlibrary.org/works/OL41068W) [Cask of Amontillado](https://openlibrary.org/works/OL41016W) [Fall of the House of Usher](https://openlibrary.org/works/OL40987W) [Masque of the Red Death](https://openlibrary.org/works/OL41050W) [Facts in the Case of M. Valdemar](https://openlibrary.org/works/OL40987W) Ligeia Murders in the Rue Morgue [Purloined Letter](https://openlibraryorg/works/OL41065W) [Descent into the Maelstrom](https://openlibrary.org/works/OL273476W) [Pit and the Pendulum](https://openlibrary.org/works/OL273550W) Ms. Found in a Bottle [Premature Burial](https://openlibrary.org/works/OL24583029W) [William Wilson](https://openlibrary.org/works/OL16088822W) [Eleonora](https://openlibrary.org/works/OL14937980W) [Silence — A Fable](https://openlibrary.org/works/OL13370628W) Narrative of Arthur Gordon Pym 15 POEMS Alone [Annabel Lee](https://openlibrary.org/works/OL273456W) Bells City in the Sea For Annie Israfel Lenore [Raven](https://openlibrary.org/works/OL41081W) Romance Sleeper Stanzas To Helen Ulalume—A Ballad Valentine Valley of Unrest,0553212281
The BFG,,0141311371
Dress Your Family in Corduroy and Denim,"David Sedaris plays in the snow with his sisters. He goes on vacation with his family. He gets a job selling drinks. He attends his brother’s wedding. He mops his sister’s floor. He gives directions to a lost traveler. He eats a hamburger. He has his blood sugar tested. It all sounds so normal, doesn’t it? In his newest collection of essays, David Sedaris lifts the corner of ordinary life, revealing the absurdity teeming below its surface. His world is alive with obscure desires and hidden motives — a world where forgiveness is automatic and an argument can be the highest form of love. Dress Your Family in Corduroy and Denim is another unforgettable collection from one of the wittiest and most original writers at work today.",0965904830
The Velveteen Rabbit,,0380002558
"Things Fall Apart (The African Trilogy, #1)",,0385474547
"Something Borrowed (Darcy & Rachel, #1)",,031232118X
Do Androids Dream of Electric Sheep?,,0345404475
The Casual Vacancy,"When Barry Fairbrother dies unexpectedly in his early forties, the little town of Pagford is left in shock. Pagford is, seemingly, an English idyll, with a cobbled market square and an ancient abbey, but what lies behind the pretty façade is a town at war. Rich at war with poor, teenagers at war with their parents, wives at war with their husbands, teachers at war with their pupils…. Pagford is not what it first seems. And the empty seat left by Barry on the town’s council soon becomes the catalyst for the biggest war the town has yet seen. Who will triumph in an election fraught with passion, duplicity and unexpected revelations? Blackly comic, thought-provoking and constantly surprising, *The Casual Vacancy* is J.K. Rowling’s first novel for adults.",0316228532
Speak,"""Speak up for yourself--we want to know what you have to say."" From the first moment of her freshman year at Merryweather High, Melinda knows this is a big fat lie, part of the nonsense of high school. She is friendless, outcast, because she busted an end-of-summer party by calling the cops, so now nobody will talk to her, let alone listen to her. As time passes, she becomes increasingly isolated and practically stops talking altogether. Only her art class offers any solace, and it is through her work on an art project that she is finally able to face what really happened at that terrible party: she was raped by an upperclassman, a guy who still attends Merryweather and is still a threat to her. Her healing process has just begun when she has another violent encounter with him. But this time Melinda fights back, refuses to be silent, and thereby achieves a measure of vindication. In Laurie Halse Anderson's powerful novel, an utterly believable heroine with a bitterly ironic voice delivers a blow to the hypocritical world of high school. She speaks for many a disenfranchised teenager while demonstrating the importance of speaking up for oneself.",014131088X
Gulliver's Travels,,0141439491
The Lorax,"Long before ""going green"" was mainstream, Dr. Seuss's Lorax spoke for the trees and warned of the dangers of disrespecting the environment. In this cautionary rhyming tale (printed on recycled paper) we learn of the Once-ler, who came across a valley of Truffula Trees and Brown Bar-ba-loots, and how his harvesting of the tufted trees changed the landscape forever. - Publisher. The Lorax is the story of a boy who's looking for answers. Living in a ruined town, this little guy wants to know the story of the Lorax, so he goes to the Once-ler, an elderly inventor/manufacturer. Doc Brown -- ahem, the Once-ler -- tells the boy how the town came to be ruined, and most importantly, what he can do to turn things around. Who exactly was this this Lorax character, what was it doing here, and why was it taken away? These are questions only a man name the Once-ler can answer. The Once-ler's last words to the boy: ""Grow a forest. Protect it from axes that hack./ Then the Lorax/ and all of his friends/ may come back."" - shmoop.com",0679889108
Still Alice,"Alice Howland, happily married with three grown children and a house on the Cape, is a celebrated Harvard professor at the height of her career when she notices a forgetfulness creeping into her life. As confusion starts to cloud her thinking and her memory begins to fail her, she receives a devastating diagnosis: early onset Alzheimer's disease.",0595440096
"A Child Called 'It'"" (Dave Pelzer #1)""",,1558743669
The Importance of Being Earnest,"Set in England during the late Victorian era, the play's humour derives in part from characters maintaining fictitious identities to escape unwelcome social obligations. It is replete with witty dialogue and satirises some of the foibles and hypocrisy of late Victorian society. It has proved Wilde's most enduringly popular play. - [*Wikipedia*][1] [1]: http://en.wikipedia.org/wiki/The_Importance_of_Being_Earnest",158049580X
Their Eyes Were Watching God,Their Eyes Were Watching God (1937) is a classic Harlem Renaissance novel by American writer Zora Neale Hurston. The novel follows Janie Crawford as she recounts the story of her life as she journeys from a naive teenager to a woman in control of her destiny.,0061120065
The Historian,"To you, perceptive reader, I bequeath my history....Late one night, exploring her father's library, a young woman finds an ancient book and a cache of yellowing letters. The letters are all addressed to ""My dear and unfortunate successor,"" and they plunge her into a world she never dreamed of-a labyrinth where the secrets of her father's past and her mother's mysterious fate connect to an inconceivable evil hidden in the depths of history. The letters provide links to one of the darkest powers that humanity has ever known-and to a centuries-long quest to find the source of that darkness and wipe it out. It is a quest for the truth about Vlad the Impaler, the medieval ruler whose barbarous reign formed the basis of the legend of Dracula. Generations of historians have risked their reputations, their sanity, and even their lives to learn the truth about Vlad the Impaler and Dracula. Now one young woman must decide whether to take up this quest herself-to follow her father in a hunt that nearly brought him to ruin years ago, when he was a vibrant young scholar and her mother was still alive. What does the legend of Vlad the Impaler have to do with the modern world? Is it possible that the Dracula of myth truly existed-and that he has lived on, century after century, pursuing his own unknowable ends? The answers to these questions cross time and borders, as first the father and then the daughter search for clues, from dusty Ivy League libraries to Istanbul, Budapest, and the depths of Eastern Europe. In city after city, in monasteries and archives, in letters and in secret conversations, the horrible truth emerges about Vlad the Impaler's dark reign-and about a time-defying pact that may have kept his awful work alive down through the ages.Parsing obscure signs and hidden texts, reading codes worked into the fabric of medieval monastic traditions-and evading the unknown adversaries who will go to any lengths to conceal and protect Vlad's ancient powers—one woman comes ever closer to the secret of her own past and a confrontation with the very definition of evil. Elizabeth Kostova's debut novel is an adventure of monumental proportions, a relentless tale that blends fact and fantasy, history and the present, with an assurance that is almost unbearably suspenseful—and utterly unforgettable.",0751537284
The Godfather,,0451205766
"The Horse and His Boy (Chronicles of Narnia, #5)",,0439861365
Dear John,"John, a high school dropout, enlists in the Army not knowing what else to do with his life. While in the Army he meets Savannah, they fall in love and she awaits his return from the Army. After 9/11 John feels it's his duty to re-enlist. During their long separation Savannah falls in love and marries someone else.",0446528056
"City of Lost Souls (The Mortal Instruments, #5)",,1442416866
Naked,"Naked, published in 1997, is a collection of essays by American humorist David Sedaris. The book details Sedaris’ life, from his unusual upbringing in the suburbs of Raleigh, North Carolina, to his booze-and-drug-ridden college years, to his Kerouacian wandering as a young adult.",0316777730
The Green Mile,"The Green Mile is a 1996 serial novel by American writer Stephen King. It tells the story of death row supervisor Paul Edgecombe's encounter with John Coffey, an unusual inmate who displays inexplicable healing and empathetic abilities. The serial novel was originally released in six volumes before being republished as a single-volume work. The book is an example of magical realism. The Green Mile won the Bram Stoker Award for Best Novel in 1996. In 1997, The Green Mile was nominated as Best Novel for the British Fantasy Award and the Locus Award. In 2003 the book was listed on the BBC's The Big Read poll of the UK's ""best-loved novel"". ---------- Contains: 1. [The Two Dead Girls](https://openlibrary.org/works/OL149165W/The_Two_Dead_Girls) 2. [The Mouse on the Mile](https://openlibrary.org/works/OL149147W/The_Mouse_on_the_Mile) 3. [Coffey's Hands](https://openlibrary.org/works/OL149107W/Coffey's_Hands) 4. [The Bad Death of Eduard Delacroix](https://openlibrary.org/works/OL15861106W/The_Bad_Death_of_Eduard_Delacroix) 5. [Night Journey](https://openlibrary.org/works/OL16252000W/Night_Journey) 6. [Coffey on the Mile](https://openlibrary.org/works/OL15136222W/Coffey_on_the_Mile)",0451933028
The Invention of Wings,"Hetty ""Handful"" Grimké, an urban slave in early nineteenth century Charleston, yearns for life beyond the suffocating walls that enclose her within the wealthy Grimké household. The Grimké's daughter, Sarah, has known from an early age she is meant to do something large in the world, but she is hemmed in by the limits imposed on women. On Sarah's eleventh birthday, she is given ownership of ten year old Handful, who is to be her handmaid. Over the next thirty-five years, both women strive for a life of their own, dramatically shaping each other's destinies and forming a complex relationship marked by guilt, defiance, estrangement and the uneasy ways of love. As the stories build to a riveting climax, Handful will endure loss and sorrow, finding courage and a sense of self in the process. Sarah will experience crushed hopes, betrayal, unrequited love, and ostracism before leaving Charleston to find her place alongside her fearless younger sister, Angelina, as one of the early pioneers in the abolition and women's rights movements. This story follows Hetty, a young slave, and Sarah, from a wealthy family, starting on Sarah's 11th birthday, when she is given ownership of Hetty, through the next 35 years of their lives. The plot contains sexual situations and graphic violence.",0670024783
"Cinder (The Lunar Chronicles, #1)",,0312641893
Mansfield Park,,0141439807
The Canterbury Tales,A story of pilgrims on their was to Canterbury.,0140424385
The Witches,,0590032496
Fear and Loathing in Las Vegas,,0679785892
"A Discovery of Witches (All Souls Trilogy, #1)",,0670022411
Breakfast of Champions,"Breakfast Of Champions is vintage Vonnegut. One of his favorite characters, aging writer Kilgore Trout, finds to his horror that a Midwest car dealer is taking his fiction as truth. The result is murderously funny satire as Vonnegut looks at war, sex, racism, success, politics, and pollution in America and reminds us how to see the truth.From the Trade Paperback edition.",0385334206
The Namesake,,0618485228
Much Ado About Nothing,,0743482751
The Boy in the Striped Pajamas,,0385751060
"The Hunt for Red October (Jack Ryan Universe, #4)",,0425172902
Nineteen Minutes,"The startling and poignant story of the aftermath of a tragic high school shooting, from the bestselling author of My Sister's Keeper and The Pact.'Picoult makes us ponder the ambiguous relationships between love and lying, legality and morality; the strange ways repressed memories leak into the present.' Los Angeles TimesIntricately textured and rich with psychological and social insight, Jodi Picoult's novels grab readers by the throat from page one and never let go. As emotionally charged as any she has written, Nineteen Minutes is one of her most powerful works to date.Set in a small town in the wake of a horrific school shooting, Nineteen Minutes features the return of two beloved Picoult characters - Jordan McAfee, the lawyer from The Pact and Salem Falls, who once again finds himself representing a boy who desperately needs someone on his side; and Patrick Ducharme, the intrepid detective introduced in Perfect Match, whose best witness is the daughter of the superior court judge assigned to the case. As the story unfolds, layer after layer is peeled back to reveal some hard-hitting questions about the nature of justice, the balance of power and what it means to be different.Nineteen Minutes is a riveting, thought-provoking tale with a jaw-dropping finale.",0743496728
Robinson Crusoe,,0375757325
Northanger Abbey,,1593082649
Wonder,"Wonder is a children's novel written by R. J. Palacio,[2] published on 14 February 2012. R. J. Palacio wrote Wonder after an incident where her son noticed a girl with a severe facial difference and started to cry. Fearing he would react badly, Palacio attempted to remove her son from the situation so as not to upset the girl and her family but ended up worsening the situation. Natalie Merchant's song of the same name made her realize that the incident could illustrate a valuable lesson. Palacio was inspired by Merchant's lyrics and she began writing. She named the book directly after the song and used the song's chorus as the prologue of the first chapter.",0375869026
"Kiss the Girls (Alex Cross, #2)",,0446677388
The Prince of Tides,"PAT CONROY has created a huge, brash thunderstorm of a novel, stinging with honesty and resounding with drama. Spanning forty years, this is the story of turbulent Tom Wingo, his gifted and troubled twin sister Savannah, and their struggle to triumph over the dark and tragic legacy of the extraordinary family into which they were born. Filled with the vanishing beauty of the South Carolina low country as well as the dusty glitter of New York City, The Prince of Tides is PAT CONROY at his very best.",0553381547
Beowulf,"Composed toward the end of the first millennium, Beowulf is the elegiac narrative of the adventures of Beowulf, a Scandinavian hero who saves the Danes from the seemingly invincible monster Grendel and, later, from Grendel's mother. He then returns to his own country and dies in old age in a vivid fight against a dragon. The poem is about encountering the monstrous, defeating it, and then having to live on in the exhausted aftermath. In the contours of this story, at once remote and uncannily familiar at the beginning of the twenty-first century, Nobel laureate Seamus Heaney finds a resonance that summons power to the poetry from deep beneath its surface. Drawn to what he has called the ""four-squareness of the utterance"" in Beowulf and its immense emotional credibility, Heaney gives these epic qualities new and convincing reality for the contemporary reader.",0393320979
Black Beauty,"(Ages 9-12, Gr. 4-7) An **animal rights classic** that's also an engaging read, **BLACK BEAUTY follows the life of an ebony horse from birth to old age**, and from pasture to the cobblestone streets of **19th century England** This morality tale and **animal ""autobiography""** gives a sweet and kind horse **a voice that's relatable yet unsentimental.**. Black Beauty's life begins on the grounds of an aristocratic English family. The **young horse learns early lessons from his mother like how not to bite or kick even in play** before circumstances force his sale to a new master; it's the first of several such sales/moves for the horse. As **his life intersects with different human owners, caretakers, and neighbors**, Black Beauty **experiences different kinds of care and abuse**, and he observes the **differing attitudes of humans toward horses.** Peppered throughout the novel are the **moral lessons** that the author, **Anna Sewell **who is the author**, wants to impart to her readers:** that **truly good humans are kind to all of God's creatures,** that **parents should teach their children to be kind to animals,** and perhaps most important, that **even though they can't speak, horses can feel so that makes this fiction/fake.** Anna Sewell was a devout Quaker, and that is apparent in her pacifist point of view, and in the book's **emphasis on the value of hard work without complaint.** **strong text** author: a person who wrote the book",0439228905
The Paris Wife,"In Chicago in 1920, 28-year-old Hadley Richardson meets Ernest Hemingway. Following a whirlwind courtship and wedding, the pair set sail for Paris and become the golden couple in a lively group of expatriots, including Scott and Zelda Fitzgerald, Gertrude Stein, Ezra Pound, and Gerald and Sara Murphy. But as Hadley struggles with self-doubt and jealousy, Ernest wrestles with his burgeoning writing career and both must confront a deception that could prove the undoing of one of the greatest romances in history.",0345521307
Hotel on the Corner of Bitter and Sweet,"""Sentimental, heartfelt....the exploration of Henry's changing relationship with his family and with Keiko will keep most readers turning pages...A timely debut that not only reminds readers of a shameful episode in American history, but cautions us to examine the present and take heed we don't repeat those injustices.""-- Kirkus Reviews""A tender and satisfying novel set in a time and a place lost forever, Hotel on the Corner of Bitter and Sweet gives us a glimpse of the damage that is caused by war--not the sweeping damage of the battlefield, but the cold, cruel damage to the hearts and humanity of individual people. Especially relevant in today's world, this is a beautifully written book that will make you think. And, more importantly, it will make you feel."" -- Garth Stein, New York Times bestselling author of The Art of Racing in the Rain""Jamie Ford's first novel explores the age-old conflicts between father and son, the beauty and sadness of what happened to Japanese Americans in the Seattle area during World War II, and the depths and longing of deep-heart love. An impressive, bitter, and sweet debut.""-- Lisa See, bestselling author of Snow Flower and the Secret FanIn the opening pages of Jamie Ford's stunning debut novel, Hotel on the Corner of Bitter and Sweet, Henry Lee comes upon a crowd gathered outside the Panama Hotel, once the gateway to Seattle's Japantown. It has been boarded up for decades, but now the new owner has made an incredible discovery: the belongings of Japanese families, left when they were rounded up and sent to internment camps during World War II. As Henry looks on, the owner opens a Japanese parasol.This simple act takes old Henry Lee back to the 1940s, at the height of the war, when young Henry's world is a jumble of confusion and excitement, and to his father, who is obsessed with the war in China and having Henry grow up American. While ""scholarshipping"" at the exclusive Rainier Elementary, where the white kids ignore him, Henry meets Keiko Okabe, a young Japanese American student. Amid the chaos of blackouts, curfews, and FBI raids, Henry and Keiko forge a bond of friendship--and innocent love--that transcends the long-standing prejudices of their Old World ancestors. And after Keiko and her family are swept up in the evacuations to the internment camps, she and Henry are left only with the hope that the war will end, and that their promise to each other will be kept.Forty years later, Henry Lee is certain that the parasol belonged to Keiko. In the hotel's dark dusty basement he begins looking for signs of the Okabe family's belongings and for a long-lost object whose value he cannot begin to measure. Now a widower, Henry is still trying to find his voice--words that might explain the actions of his nationalistic father; words that might bridge the gap between him and his modern, Chinese American son; words that might help him confront the choices he made many years ago. Set during one of the most conflicted and volatile times in American history, Hotel on the Corner of Bitter and Sweet is an extraordinary story of commitment and enduring hope. In Henry and Keiko, Jamie Ford has created an unforgettable duo whose story teaches us of the power of forgiveness and the human heart.From the Hardcover edition.",0345505336
Stranger in a Strange Land,"Stranger in a Strange Land is a 1961 science fiction novel by American author Robert A. Heinlein. It tells the story of Valentine Michael Smith, a human who comes to Earth in early adulthood after being born on the planet Mars and raised by Martians. The novel explores his interaction with—and eventual transformation of—terrestrial culture. The title is an allusion to the phrase in Exodus 2:22. According to Heinlein, the novel's working title was The Heretic. Several later editions of the book have promoted it as ""The most famous Science Fiction Novel ever written"".",0441788386
"The Final Empire (Mistborn, #1)",,076531178X
"The No. 1 Ladies'' Detective Agency  (No. 1 Ladies'' Detective Agency, #1)",,1400034779
"Speaker for the Dead (Ender''s Saga, #2)",,0812550757
