title,sinopsis,isbn
The Sirens of Titan,"""His best book,"" Esquire wrote of Kurt Vonnegut's 1959 novel The Sirens of Titan, adding, ""he dares not only to ask the ultimate question about the meaning of life, but to answer it."" This novel fits into that aspect of the Vonnegut canon that might be classified as science fiction, a quality that once led Time to describe Vonnegut as ""George Orwell, Dr. Caligari and Flash Gordon compounded into one writer ... a zany but moral mad scientist."" The Sirens of Titan was perhaps the novel that began the Vonnegut phenomenon with readers. The story is a fabulous trip, spinning madly through space and time in pursuit of nothing less than a fundamental understanding of the meaning of life. It takes place at a time in the future, when ""only the human soul remained terra incognita ... the Nightmare Ages, falling roughly, give or take a few years, between the Second World War and the Third Great Depression."" The villainous and super rich Malachi Constant is offered a chance to journey into the far reaches of outer space, to eventually live on the planet Titan surrounded by three beautiful sirens. There is the proverbial ""small print"" with this incredible offer, which Constant turns down, setting in motion a fantastic chain of events that only Vonnegut could imagine. The result is an uproarious, freewheeling inquiry into the very reason we exist and about how we participate and matter in the scheme of the universe. The Sirens of Titan is essential, fundamental Vonnegut, as entertaining as it is questing in search of answers to the mysteries of life. As a work of fiction, it is a sure leap, in terms of craft, over his first novel, Player Piano. His writing here is pared down, more concentrated and graceful, richly in the service of his remarkable ideas. Vonnegut summons greatness for the first time in The Sirens of Titan, where the search for the meaning of existence looks and sounds like a kaleidoscopic dream but leaves the reader with a clear and challenging answer.",1857988841
Cryptonomicon,"Neal Stephenson hacks into the secret histories of nations and the private obsessions of men, decrypting with dazzling virtuosity the forces that shaped this century. In 1942, Lawrence Pritchard Waterhouse - mathematical genius and young Captain in the US Navy - is assigned to Detachment 2702. It is an outfit so secret that only a handful of people know it exists, and some of those people have names like Churchill and Roosevelt. The mission of Watrehouse and Detachment 2702 - commanded by Marine Raider Bobby Shaftoe - is to keep the Nazis ignorant of the fact that Allied Intelligence has cracked the enemy's fabled Enigma code. It is a game, a cryptographic chess match between Waterhouse and his German counterpart, translated into action by the gung-ho Shaftoe and his forces. Fast-forward to the present, where Waterhouse's crypto-hacker grandson, Randy, is attempting to create a ""data haven"" in Southeast Asia - a place where encrypted data can be stored and exchanged free of repression and scrutiny. As governments and multinationals attack the endeavor, Randy joins forces with Shaftoe's tough-as-nails granddaughter, Amy, to secretly salvage a sunken Nazi submarine that holds the key to keeping the dream of a data haven afloat. But soon their scheme brings to light a massive conspiracy, with its roots in Detachment 2702, linked to an unbreakable Nazi code called Arethusa. And it will represent the path to unimaginable riches and a future of personal and digital liberty...or to universal totalitarianism reborn. A breathtaking tour de force, and Neal Stephenson's most accomplished and affecting work to date, Cryptonomicon is profound and prophetic, hypnotic and hyper-driven, as it leaps forward and back between World War II and the World Wide Web, hinting all the while at a dark day-after-tomorrow. It is a work of great art, thought, and creative daring.",0060512806
"Animal, Vegetable, Miracle: A Year of Food Life",,0060852550
The Day of the Jackal,"In a class by itself. Unputdownable' Sunday TimesOne of the most celebrated thrillers ever written, The Day of the Jackal is the electrifying story of an anonymous Englishman who in, the spring of 1963, was hired by Colonel Marc Rodin, Operations Chief of the O. A. S., to assassinate General de Gaulle. The Jackal. A tall, blond Englishman with opaque, gray eyes. A killer at the top of his profession. A man unknown to any secret service in the world. An assassin with a contract to kill the world's most heavily guarded man. One man with a rifle who can change the course of history. One man whose mission is so secretive not even his employers know his name. And as the minutes count down to the final act of execution, it seems that there is no power on earth that can stop the Jackal.",0553266306
"The Blood of Olympus (The Heroes of Olympus, #5)",,1484724917
"Seven Up (Stephanie Plum, #7)",,0312980140
"The Borrowers (The Borrowers, #1)",,0152047379
The Woman in White,,0141439610
"Small Gods (Discworld, #13)",,0552152978
This Lullaby,"When it comes to relationships, Remy Starr doesn't mess around. After all, she's learned all there is to know from her mother, who's currently working on husband number five. But there's something about Dexter that seems to defy all of Remy's rules. He certainly doesn't seem like Mr. Right. For some reason, however, Remy just can't seem to get him out of her head. Could it be that Remy's starting to understand what those love songs are all about? From acclaimed author Sarah Dessen, this is a captivating novel about a tough-as-nails girl and the unexpectedly charming boy who's determined to soften her up, and be the man she wants.",0142501557
"The Throne of Fire (Kane Chronicles, #2)",,1423140567
I Am Malala: The Story of the Girl Who Stood Up for Education and Was Shot by the Taliban,,0316322407
Children of Dune (Dune Chronicles #3),,0441104029
"Moon Called (Mercy Thompson, #1)",,0441013813
The Tale of Despereaux,,0763625299
"Hard Eight (Stephanie Plum, #8)",,0312983867
The Tiger's Wife,"Remembering childhood stories her grandfather once told her, young physician Natalia becomes convinced that he spent his last days searching for ""the deathless man,"" a vagabond who claimed to be immortal. As Natalia struggles to understand why her grandfather, a deeply rational man would go on such a farfetched journey, she stumbles across a clue that leads her to the extraordinary story of the tiger's wife.",0385343833
The Tao of Pooh,"The how of Pooh? The Tao of who? The Tao of Pooh!?! Yes, Winnie-the-Pooh has a certain Way about him, a way of doing things that has made him the world's most beloved bear. In these pages Benjamin Hoff shows that Pooh's Way is amazingly consistent with the principles of living envisioned long ago by the Chinese founders of Taoism. The author's explanation of Taoism is through Pooh, and Pooh through Taoism, shows that this is not simply an ancient and remote philosophy but something you can use, here and now. And what is Taoism? It's really very simple. It calls for living without preconceived ideas about how life should be lived--but it's not a preconception of how life--It's... Well, you'd do better to read this book, and listen to Pooh, if you really want to find out. --front flap",1405204265
"Knife of Dreams (Wheel of Time, #11)",,0812577566
"Requiem (Delirium, #3)",,0062014536
Chicka Chicka Boom Boom,,068983568X
The Stinky Cheese Man and Other Fairly Stupid Tales,"The Stinky Cheese Man and Other Fairly Stupid Tales is the ultimate in fractured fairy tales. Not only do the characters create their own stories, they also design the structure of the book itself. Classic fairy tales are deconstructed and rewritten with different but recognizable names, such as The Princess and the Bowling Ball, The Really Ugly Duckling, The Tortoise and the Hair and Chicken Licken. These stories and their characters intersect and create a mish-mash of narratives. Scieszka also mocks the conventions of books in general; the title page, dedication, and even the public information page have all been deconstructed. For example, Scieszka sneaks in the line “Anyone caught telling these fairly stupid tales will be visited, in person, by the Stinky Cheese Man” on the publication data page.",067084487X
"The Miserable Mill (A Series of Unfortunate Events, #4)",,0439272637
"Lean In: Women, Work, and the Will to Lead",,0385349947
A Bend in the Road,"Miles Ryan's life seemed to end the day his wife was killed in a hit-and-run accident two years ago. As deputy sheriff of New Bern, North Carolina, he not only grieves for her and worries about their young son Jonah but longs to bring the unknown driver to justice. Then Miles meets Sarah Andrews, Jonah's second-grade teacher. A young woman recovering from a difficult divorce. Sarah moved to New Bern hoping to start over. Tentatively, Miles and Sarah reach out to each other... soon they are falling in love. But what neither realizes is that they are also bound together by a shocking secret, one that will force them to reexamine everything they believe in - including their love.",0446696137
"Diary of a Wimpy Kid (Diary of a Wimpy Kid, #1)",,0810993139
"The Foundation Trilogy (Foundation, #1-3)",,0380508567
"Mostly Harmless (Hitchhiker''s Guide to the Galaxy, #5)",,0345418778
"Lover Awakened (Black Dagger Brotherhood, #3)",,0451219368
"Dead Beat (The Dresden Files, #7)",,045146091X
"The Way of Shadows (Night Angel, #1)",,0316033677
The King of Torts,"The office of the public defender is not known as a training ground for bright young litigators. Clay Carter has been there too long and, like most of his colleagues, dreams of a better job in a real firm. When he reluctantly takes the case of a young man charged with a random street killing, he assumes it is just another of the many senseless murders that hit D.C. every week. As he digs into the background of his client, Clay stumbles on a conspiracy too horrible to believe. He suddenly finds himself in the middle of a complex case against one of the largest pharmaceutical companies in the world, looking at the kind of enormous settlement that would totally change his life--that would make him, almost overnight, the legal profession's newest king of torts...",0385339658
Attachments,"""Hi, I'm the guy who reads your e-mail, and also, I love you . . . "" Beth Fremont and Jennifer Scribner-Snyder know that somebody is monitoring their work e-mail. (Everybody in the newsroom knows. It's company policy.) But they can't quite bring themselves to take it seriously. They go on sending each other endless and endlessly hilarious e-mails, discussing every aspect of their personal lives. Meanwhile, Lincoln O'Neill can't believe this is his job now- reading other people's e-mail. When he applied to be ""internet security officer,"" he pictured himself building firewalls and crushing hackers- not writing up a report every time a sports reporter forwards a dirty joke. When Lincoln comes across Beth's and Jennifer's messages, he knows he should turn them in. But he can't help being entertained-and captivated-by their stories. By the time Lincoln realizes he's falling for Beth, it's way too late to introduce himself. What would he say . . . ?",0525951989
"Something Wicked This Way Comes (Green Town, #2)",,0380729407
"The Hunger Games Trilogy Boxset (The Hunger Games, #1-3)",,0545265355
"Bridget Jones: The Edge of Reason (Bridget Jones, #2)",,0140298479
The Perfect Storm: A True Story of Men Against the Sea,,0393050327
"Assassin''s Quest (Farseer Trilogy, #3)",,0553565699
Twenties Girl,"Lara Lington has always had an overactive imagination, but suddenly that imagination seems to be in overdrive. Normal professional twenty-something young women don't get visited by ghosts. Or do they? When the spirit of Lara's great-aunt Sadie-a feisty, demanding girl with firm ideas about fashion, love, and the right way to dance-mysteriously appears, she has one request: Lara must find a missing necklace that had been in Sadie's possession for more than seventy-five years, because Sadie cannot rest without it. Lara and Sadie make a hilarious sparring duo, and at first it seems as though they have nothing in common. But as the mission to find Sadie's necklace leads to intrigue and a new romance for Lara, these very different ""twenties"" girls learn some surprising truths from and about each other. Written with all the irrepressible charm and humor that have made Sophie Kinsella's books beloved by millions, Twenties Girl is also a deeply moving testament to the transcendent bonds of friendship and family.",0385342020
"Old Yeller (Old Yeller, #1)",,0060935472
The Moon is a Harsh Mistress,"It is the late 21st Century and the Moon has been colonized -- as a giant, open, prison. Every aspect of life is overseen by the Federated Nations ""Lunar Authority""; until one day when a self-aware Super-Computer, a Jack of all Trades Technician, an Anarchist Professor, and a beautiful Blonde Revolutionary decide to change their world. The conspirators' plans go along beautifully...for a while. TANSTAAFL! There ain't no such thing as a free lunch! Robert A. Heinlein was the most influential science fiction writer of his era, an influence so large that, as Samuel R. Delany notes, ""modern critics attempting to wrestle with that influence feel themselves dealing with an object rather like the sky or an ocean."" He won the Hugo Award for best novel four times, a record that still stands. The Moon Is a Harsh Mistress was the last of these Hugo-winning novels, and it is widely considered his finest work. It is a tale of revolution, of the rebellion of the former Lunar penal colony against the Lunar Authority that controls it from Earth. It is the tale of the disparate people -- a computer technician, a vigorous young female agitator, and an elderly academic -- who become the rebel movement's leaders. And it is the story of Mike, the supercomputer whose sentience is known only to this inner circle, and who for reasons of his own is committed to the revolution's ultimate success. The Moon Is a Harsh Mistress is one of the high points of modern science fiction, a novel bursting with politics, humanity, passion, innovative technical speculation, and a firm belief in the pursuit of human freedom. - Back cover.",0340837942
"To the Nines (Stephanie Plum, #9)",,0747267634
A Moveable Feast,"A Moveable Feast is a 1964 memoir belles-lettres by American author Ernest Hemingway about his years as a struggling expat journalist and writer in Paris during the 1920s. It was published posthumously.[1] The book details Hemingway's first marriage to Hadley Richardson and his associations with other cultural figures of the Lost Generation in Interwar France. The memoir consists of various personal accounts by Hemingway and involves many notable figures of the time, such as Sylvia Beach, Hilaire Belloc, Bror von Blixen-Finecke, Aleister Crowley, John Dos Passos, F. Scott and Zelda Fitzgerald, Ford Madox Ford, James Joyce, Wyndham Lewis, Pascin, Ezra Pound, Evan Shipman, Gertrude Stein, Alice B. Toklas, and Hermann von Wedderkop. The work also references the addresses of specific locations such as bars, cafes, and hotels, many of which can still be found in Paris today. Ernest Hemingway's suicide in July 1961 delayed the publication of the book due to copyright issues and several edits which were made to the final draft. The memoir was published posthumously in 1964, three years after Hemingway's death, by his fourth wife and widow, Mary Hemingway, based upon his original manuscripts and notes. An edition altered and revised by his grandson, Seán Hemingway, was published in 2009.",0099285045
"The Light Fantastic (Discworld, #2; Rincewind #2)",,0061020702
Rules of Civility,"A chance encounter with a handsome banker in a jazz bar on New Year's Eve 1938 catapults Wall Street secretary Katey Kontent into the upper echelons of New York society, where she befriends a shy multi-millionaire, an Upper East Side ne'er-do-well, and a single-minded widow.",0670022691
Loving Frank,"I have been standing on the side of life, watching it float by. I want to swim in the river. I want to feel the current.So writes Mamah Borthwick Cheney in her diary as she struggles to justify her clandestine love affair with Frank Lloyd Wright. Four years earlier, in 1903, Mamah and her husband, Edwin, had commissioned the renowned architect to design a new home for them. During the construction of the house, a powerful attraction developed between Mamah and Frank, and in time the lovers, each married with children, embarked on a course that would shock Chicago society and forever change their lives. In this ambitious debut novel, fact and fiction blend together brilliantly. While scholars have largely relegated Mamah to a footnote in the life of America's greatest architect, author Nancy Horan gives full weight to their dramatic love story and illuminates Cheney's profound influence on Wright. Drawing on years of research, Horan weaves little-known facts into a compelling narrative, vividly portraying the conflicts and struggles of a woman forced to choose between the roles of mother, wife, lover, and intellectual. Horan's Mamah is a woman seeking to find her own place, her own creative calling in the world. Mamah's is an unforgettable journey marked by choices that reshape her notions of love and responsibility, leading inexorably ultimately lead to this novel's stunning conclusion. Elegantly written and remarkably rich in detail, Loving Frank is a fitting tribute to a courageous woman, a national icon, and their timeless love story.Advance praise for Loving Frank:""Loving Frank is one of those novels that takes over your life. It's mesmerizing and fascinating--filled with complex characters, deep passions, tactile descriptions of astonishing architecture, and the colorful immediacy of daily life a hundred years ago--all gathered into a story that unfolds with riveting urgency.""--Lauren Belfer, author of City of Light""This graceful, assured first novel tells the remarkable story of the long-lived affair between Frank Lloyd Wright, a passionate and impossible figure, and Mamah Cheney, a married woman whom Wright beguiled and led beyond the restraint of convention. It is engrossing, provocative reading.""--Scott Turow""It takes great courage to write a novel about historical people, and in particular to give voice to someone as mythic as Frank Lloyd Wright. This beautifully written novel about Mamah Cheney and Frank Lloyd Wright's love affair is vivid and intelligent, unsentimental and compassionate.""--Jane Hamilton""I admire this novel, adore this novel, for so many reasons: The intelligence and lyricism of the prose. The attention to period detail. The epic proportions of this most fascinating love story. Mamah Cheney has been in my head and heart and soul since reading this book; I doubt she'll ever leave.""--Elizabeth BergFrom the Hardcover edition.",0345494997
"Proven Guilty (The Dresden Files, #8)",,0451461037
"Night Watch (Discworld, #29; City Watch, #6)",,055215430X
"Burned (House of Night, #7)",,1905654944
Sycamore Row,"In this novel the author takes you back to where it all began in A Time to Kill. Now we return to that famous courthouse in Clanton as Jake Brigance once again finds himself embroiled in a fiercely controversial trial; a trial that will expose old racial tensions and force Ford County to confront its tortured history. Seth Hubbard is a wealthy man dying of lung cancer. He trusts no one. Before he hangs himself from a sycamore tree, Hubbard leaves a new, handwritten, will. It is an act that drags his adult children, his black maid, and Jake into a conflict as riveting and dramatic as the murder trial that made Brigance one of Ford County's most notorious citizens, just three years earlier. The second will raises far more questions than it answers. Why would Hubbard leave nearly all of his fortune to his maid? Had chemotherapy and painkillers affected his ability to think clearly? And what foes ita ll have to do with a piece of land once known as Sycamore Row? -- From book jacket.",0385537131
"White Night (The Dresden Files, #9)",,0451461401
Horton Hears a Who!,A city of Whos on a speck of dust are threatened with destruction until the smallest Who of all helps convince Horton's friends that Whos really exist.,0679800034
Winter of the World (The Century Trilogy #2),,0525952926
"All the Pretty Horses (The Border Trilogy, #1)",,0679744398
In Defense of Food: An Eater's Manifesto,,1594201455
"Stone of Tears (Sword of Truth, #2)",,0312857063
"The Big Sleep (Philip Marlowe, #1)",,0394758285
Rosencrantz and Guildenstern Are Dead,,0802132758
"Blue Bloods (Blue Bloods, #1)",,0786838922
Dreams from My Father: A Story of Race and Inheritance,,1921351438
"Entwined with You (Crossfire, #3)",,0425263924
Harriet the Spy (Harriet the Spy #1),,0440416795
Veronika Decides to Die,,0061124265
"The Summoning (Darkest Powers, #1)",,0061662690
The Jungle Books,,0451529758
The Broker,"With 14 years left on a 20 year sentence, notorious Washington powerbroker Joel Blackman receives a surprise pardon from a lame duck President. Smuggled out of the country, he is given a new identity and tucked away in a small town in Italy.",0385340540
"On the Banks of Plum Creek  (Little House, #4)",,0060885408
"The Eternity Code (Artemis Fowl, #3)",,0141321318
"Behind the Beautiful Forevers: Life, Death, and Hope in a Mumbai Undercity",,1400067553
The Choice,"Travis Parker has everything a man could want: a good job, loyal friends, even a waterfront home in small-town North Carolina. In full pursuit of the good life—boating, swimming, and regular barbecues with his good-natured buddies—he holds the vague conviction that a serious relationship with a woman would only cramp his style. That is, until Gabby Holland moves in next door. Despite his attempts to be neighborly, the appealing redhead seems to have a chip on her shoulder about him and the presence of her longtime boyfriend doesn’t help. Despite himself, Travis can’t stop trying to ingratiate himself with his new neighbor, and his persistent efforts lead them both to the doorstep of a journey that neither could have foreseen. Spanning the eventful years of young love, marriage and family, *The Choice* ultimately confronts us with the most heart-wrenching question of all: how far would you go to keep the hope of love alive?",0446579920
State of Fear,"State of Fear is a 2004 techno-thriller novel by Michael Crichton, his fourteenth under his own name and twenty-fourth overall, in which eco-terrorists plot mass murder to publicize the danger of global warming. Despite being a work of fiction, the book contains many graphs and footnotes, two appendices, and a 20-page bibliography in support of Crichton's beliefs about global warming. Many climate scientists, science journalists, environmental groups, and science advocacy organisations dispute Crichton's views on the science as being error-filled and distorted. The novel had an initial print run of 1.5 million copies and reached the #1 bestseller position at Amazon and #2 on The New York Times Best Seller list for one week in January 2005. The novel itself has garnered mixed reviews, with some literary reviewers stating that the book's presentation of facts and stance on the global warming debate detracted from the book's plot.",0061015733
"The Boxcar Children (The Boxcar Children, #1)",,0807508527
"Wallbanger (Cocktail, #1)",,1623420024
Her Fearful Symmetry,"At last: another brilliant, original and moving novel from the author of THE TIME TRAVELER'S WIFE. Julia and Valentina Poole are normal American teenagers — normal, at least, for identical 'mirror' twins who have no interest in college or jobs or possibly anything outside their cozy suburban home. But everything changes when they receive notice that an aunt whom they didn't know existed has died and left them her flat in an apartment block overlooking Highgate Cemetery in London. They feel that at last their own lives can begin . . . but have no idea that they've been summoned into a tangle of fraying lives, from the obsessive-compulsive crossword setter who lives above them to their aunt's mysterious and elusive lover who lives below them, and even to their aunt herself, who never got over her estrangement from the twins' mother — and who can't even seem to quite leave her flat . . . With Highgate Cemetery itself a character and echoes of Henry James and Charles Dickens, HER FEARFUL SYMMETRY is a delicious and deadly twenty-first-century ghost story about Niffenegger's familiar themes of love, loss and identity. It is certain to cement her standing as one of the most singular and remarkable novelists of our time.",0224085611
"Shopaholic Takes Manhattan (Shopaholic, #2)",,0440241812
The Gift of the Magi,,141693586X
Native Son,"Native Son (1940) is a novel written by the American author Richard Wright. It tells the story of 20-year-old Bigger Thomas, a black youth living in utter poverty in a poor area on Chicago's South Side in the 1930s. ---------- Also contained in: [Early Works](https://openlibrary.org/works/OL506449W)",006083756X
